{"$schema":"http://json-schema.org/draft-07/schema#","type":"object","required":["glossary","commands","events","policies","aggregates","boundedContexts","openQuestions","version","updatedAt"],"properties":{"goal":{"type":"string"},"scope":{"type":"object","required":["in","out"],"properties":{"in":{"type":"array","items":{"type":"string"}},"out":{"type":"array","items":{"type":"string"}}},"additionalProperties":false},"actors":{"type":"array","items":{"type":"string"}},"glossary":{"type":"array","items":{"type":"object","required":["term","definition"],"properties":{"term":{"type":"string"},"definition":{"type":"string"},"synonyms":{"type":"array","items":{"type":"string"}}},"additionalProperties":false}},"commands":{"type":"array","items":{"type":"object","required":["name"],"properties":{"name":{"type":"string"},"description":{"type":"string"},"actor":{"type":"string"}},"additionalProperties":false}},"events":{"type":"array","items":{"type":"object","required":["name"],"properties":{"name":{"type":"string"},"description":{"type":"string"}},"additionalProperties":false}},"policies":{"type":"array","items":{"type":"object","required":["trigger","emits"],"properties":{"trigger":{"type":"string"},"condition":{"type":"string"},"emits":{"type":"array","items":{"type":"string"}}},"additionalProperties":false}},"aggregates":{"type":"array","items":{"type":"object","required":["name","invariants","ownsCommands","emitsEvents"],"properties":{"name":{"type":"string"},"invariants":{"type":"array","items":{"type":"string"}},"ownsCommands":{"type":"array","items":{"type":"string"}},"emitsEvents":{"type":"array","items":{"type":"string"}}},"additionalProperties":false}},"boundedContexts":{"type":"array","items":{"type":"object","required":["name","responsibilities","integrations"],"properties":{"name":{"type":"string"},"responsibilities":{"type":"array","items":{"type":"string"}},"integrations":{"type":"array","items":{"type":"string"}}},"additionalProperties":false}},"capabilities":{"type":"array","items":{"type":"object","required":["name","specId"],"properties":{"name":{"type":"string"},"specId":{"type":"string"}},"additionalProperties":false}},"openQuestions":{"type":"array","items":{"type":"string"}},"conflicts":{"type":"array","items":{"type":"string"}},"decisions":{"type":"array","items":{"type":"object","properties":{"what":{"type":"string"},"why":{"type":"string"},"when":{"type":"string"}},"additionalProperties":false}},"assumptions":{"type":"array","items":{"type":"object","required":["statement"],"properties":{"statement":{"type":"string"},"confidence":{"type":"string","enum":["low","medium","high"]}},"additionalProperties":false}},"neededInfo":{"type":"array","items":{"type":"string"}},"version":{"type":"integer","minimum":0},"updatedAt":{"type":"string","format":"date-time"},"metrics":{"type":"object","properties":{"orphanCommands":{"type":"integer"},"orphanEvents":{"type":"integer"},"conflictsCount":{"type":"integer"},"ambiguousGlossaryTerms":{"type":"integer"},"boundaryViolations":{"type":"integer"},"contextMapCycles":{"type":"integer"}},"additionalProperties":true},"contradictions":{"type":"array","items":{"type":"string"}}},"additionalProperties":false}
